[
  {
    "id": "SQL-INJECTION",
    "name": "SQL 注入",
    "name_en": "SQL Injection",
    "category": "injection",
    "owasp": "A05:2025",
    "cwe": ["CWE-89"],
    "severity": "critical",
    "description": "用户输入被拼接到 SQL 语句中执行",
    "description_en": "User input is concatenated into SQL statements",
    "java_affected": ["JDBC", "MyBatis", "JPA", "Hibernate"],
    "doc_path": "docs/vulnerabilities/injection/sql-injection.md",
    "examples": {
      "vulnerable": "examples/vulnerable/SqlInjectionVulnerable.java",
      "secure": "examples/secure/SqlInjectionSecure.java"
    },
    "semgrep_rule": "docs/tools/semgrep-rules/sql-injection.yml",
    "detection_methods": ["静态分析", "动态测试", "SQLMap"],
    "mitigation": ["参数化查询", "输入校验", "最小权限"],
    "tags": ["injection", "jdbc", "mybatis", "jpa", "database"],
    "last_updated": "2026-04-17",
    "references": [
      "https://owasp.org/www-community/attacks/SQL_Injection",
      "https://cwe.mitre.org/data/definitions/89.html"
    ]
  },
  {
    "id": "XSS",
    "name": "跨站脚本攻击",
    "name_en": "Cross-Site Scripting",
    "category": "injection",
    "owasp": "A05:2025",
    "cwe": ["CWE-79"],
    "severity": "high",
    "description": "恶意脚本被注入到网页中执行",
    "description_en": "Malicious scripts are injected into web pages",
    "java_affected": ["JSP", "Thymeleaf", "FreeMarker", "Velocity"],
    "doc_path": "docs/vulnerabilities/injection/xss.md",
    "detection_methods": ["静态分析", "动态测试", "手动审计"],
    "mitigation": ["输出编码", "Content-Security-Policy", "输入校验"],
    "tags": ["injection", "xss", "jsp", "thymeleaf", "frontend"],
    "last_updated": "2026-04-17",
    "references": [
      "https://owasp.org/www-community/attacks/xss/",
      "https://cwe.mitre.org/data/definitions/79.html"
    ]
  },
  {
    "id": "COMMAND-INJECTION",
    "name": "命令注入",
    "name_en": "Command Injection",
    "category": "injection",
    "owasp": "A05:2025",
    "cwe": ["CWE-78", "CWE-77"],
    "severity": "critical",
    "description": "用户输入被拼接到系统命令中执行",
    "description_en": "User input is concatenated into system commands",
    "java_affected": ["Runtime.exec()", "ProcessBuilder"],
    "doc_path": "docs/vulnerabilities/injection/command-injection.md",
    "detection_methods": ["静态分析", "动态测试"],
    "mitigation": ["避免系统命令调用", "参数化", "输入校验"],
    "tags": ["injection", "rce", "runtime", "processbuilder"],
    "last_updated": "2026-04-17",
    "references": [
      "https://owasp.org/www-community/attacks/Command_Injection",
      "https://cwe.mitre.org/data/definitions/78.html"
    ]
  },
  {
    "id": "PATH-TRAVERSAL",
    "name": "路径遍历",
    "name_en": "Path Traversal",
    "category": "file-operations",
    "owasp": "A01:2025",
    "cwe": ["CWE-22"],
    "severity": "high",
    "description": "通过 ../ 等字符访问受限目录",
    "description_en": "Access restricted directories using ../ etc.",
    "java_affected": ["FileInputStream", "Files.readAllBytes", "File API"],
    "doc_path": "docs/vulnerabilities/file-operations/path-traversal.md",
    "detection_methods": ["静态分析", "动态测试"],
    "mitigation": ["路径规范化", "白名单校验", "沙箱隔离"],
    "tags": ["file-operations", "path-traversal", "directory-traversal"],
    "last_updated": "2026-04-17",
    "references": [
      "https://owasp.org/www-community/attacks/Path_Traversal",
      "https://cwe.mitre.org/data/definitions/22.html"
    ]
  },
  {
    "id": "FILE-UPLOAD",
    "name": "任意文件上传",
    "name_en": "Unrestricted File Upload",
    "category": "file-operations",
    "owasp": "A04:2025",
    "cwe": ["CWE-434"],
    "severity": "critical",
    "description": "上传恶意文件导致远程代码执行",
    "description_en": "Upload malicious files leading to RCE",
    "java_affected": ["MultipartFile", "Servlet FileUpload", "Commons IO"],
    "doc_path": "docs/vulnerabilities/file-operations/file-upload.md",
    "detection_methods": ["静态分析", "动态测试"],
    "mitigation": ["白名单扩展名", "文件内容校验", "重命名", "独立存储"],
    "tags": ["file-operations", "file-upload", "rce", "multipart"],
    "last_updated": "2026-04-17",
    "references": [
      "https://owasp.org/www-community/vulnerabilities/Unrestricted_File_Upload",
      "https://cwe.mitre.org/data/definitions/434.html"
    ]
  },
  {
    "id": "DESERIALIZATION",
    "name": "反序列化漏洞",
    "name_en": "Insecure Deserialization",
    "category": "deserialization",
    "owasp": "A08:2025",
    "cwe": ["CWE-502"],
    "severity": "critical",
    "description": "反序列化不可信数据导致 RCE",
    "description_en": "Deserializing untrusted data leads to RCE",
    "java_affected": ["ObjectInputStream", "Fastjson", "Jackson", "Hessian", "XStream", "SnakeYAML"],
    "doc_path": "docs/vulnerabilities/deserialization/deserialization.md",
    "semgrep_rule": "docs/tools/semgrep-rules/deserialization.yml",
    "detection_methods": ["静态分析", "ysoserial", "marshalsec"],
    "mitigation": ["白名单过滤", "禁用 AutoType", "使用安全格式"],
    "tags": ["deserialization", "rce", "objectinputstream", "fastjson", "jackson"],
    "last_updated": "2026-04-17",
    "references": [
      "https://owasp.org/www-community/attacks/Deserialization_of_untrusted_data",
      "https://cwe.mitre.org/data/definitions/502.html"
    ]
  },
  {
    "id": "BROKEN-ACCESS-CONTROL",
    "name": "访问控制失效",
    "name_en": "Broken Access Control",
    "category": "authentication",
    "owasp": "A01:2025",
    "cwe": ["CWE-862", "CWE-863", "CWE-284"],
    "severity": "high",
    "description": "未能正确实施权限限制",
    "description_en": "Failure to properly enforce permission restrictions",
    "java_affected": ["Spring Security", "Shiro", "自定义权限控制"],
    "doc_path": "docs/vulnerabilities/authentication/README.md",
    "detection_methods": ["静态分析", "权限测试"],
    "mitigation": ["RBAC", "服务端权限校验", "最小权限原则"],
    "tags": ["authentication", "authorization", "access-control", "spring-security"],
    "last_updated": "2026-04-17",
    "references": [
      "https://owasp.org/Top10/A01_2021-Broken_Access_Control/",
      "https://cwe.mitre.org/data/definitions/862.html"
    ]
  },
  {
    "id": "AUTHENTICATION-BYPASS",
    "name": "身份认证绕过",
    "name_en": "Authentication Bypass",
    "category": "authentication",
    "owasp": "A07:2025",
    "cwe": ["CWE-287", "CWE-306"],
    "severity": "critical",
    "description": "绕过身份认证机制",
    "description_en": "Bypass authentication mechanism",
    "java_affected": ["Session", "JWT", "OAuth", "自定义认证"],
    "doc_path": "docs/vulnerabilities/authentication/README.md",
    "detection_methods": ["静态分析", "渗透测试"],
    "mitigation": ["强认证机制", "MFA", "Session安全管理"],
    "tags": ["authentication", "bypass", "jwt", "session", "oauth"],
    "last_updated": "2026-04-17",
    "references": [
      "https://owasp.org/www-community/attacks/Authentication_Bypass",
      "https://cwe.mitre.org/data/definitions/287.html"
    ]
  },
  {
    "id": "SSRF",
    "name": "服务端请求伪造",
    "name_en": "Server-Side Request Forgery",
    "category": "injection",
    "owasp": "A10:2025",
    "cwe": ["CWE-918"],
    "severity": "high",
    "description": "服务端发起伪造请求访问内部资源",
    "description_en": "Server makes forged requests to internal resources",
    "java_affected": ["HttpClient", "HttpURLConnection", "OkHttp", "RestTemplate"],
    "doc_path": "docs/vulnerabilities/injection/ssrf.md",
    "detection_methods": ["静态分析", "动态测试"],
    "mitigation": ["URL白名单", "禁止内网访问", "输入校验"],
    "tags": ["injection", "ssrf", "httpclient", "resttemplate"],
    "last_updated": "2026-04-17",
    "references": [
      "https://owasp.org/www-community/attacks/Server_Side_Request_Forgery",
      "https://cwe.mitre.org/data/definitions/918.html"
    ]
  },
  {
    "id": "XXE",
    "name": "XML外部实体注入",
    "name_en": "XML External Entity Injection",
    "category": "injection",
    "owasp": "A05:2025",
    "cwe": ["CWE-611"],
    "severity": "high",
    "description": "XML解析器处理外部实体导致信息泄露或RCE",
    "description_en": "XML parser processes external entities leading to data disclosure or RCE",
    "java_affected": ["SAXParser", "DocumentBuilder", "XMLReader", "JAXB"],
    "doc_path": "docs/vulnerabilities/injection/xxe.md",
    "detection_methods": ["静态分析", "动态测试"],
    "mitigation": ["禁用外部实体", "禁用DTD", "使用安全的解析器配置"],
    "tags": ["injection", "xxe", "xml", "sax", "documentbuilder"],
    "last_updated": "2026-04-17",
    "references": [
      "https://owasp.org/www-community/attacks/XXE",
      "https://cwe.mitre.org/data/definitions/611.html"
    ]
  },
  {
    "id": "CRYPTO-FAILURE",
    "name": "加密机制失效",
    "name_en": "Cryptographic Failures",
    "category": "crypto",
    "owasp": "A04:2025",
    "cwe": ["CWE-327", "CWE-798", "CWE-311"],
    "severity": "high",
    "description": "使用弱加密算法或密钥管理不当",
    "description_en": "Use of weak cryptographic algorithms or improper key management",
    "java_affected": ["MessageDigest", "Cipher", "KeyStore", "SecretKey"],
    "doc_path": "docs/vulnerabilities/crypto/crypto-failure.md",
    "detection_methods": ["静态分析", "配置审计"],
    "mitigation": ["使用强加密算法", "密钥管理服务", "密码安全存储"],
    "tags": ["crypto", "weak-algorithm", "md5", "des", "key-management"],
    "last_updated": "2026-04-17",
    "references": [
      "https://owasp.org/Top10/A02_2021-Cryptographic_Failures/",
      "https://cwe.mitre.org/data/definitions/327.html"
    ]
  },
  {
    "id": "SECURITY-MISCONFIGURATION",
    "name": "安全配置错误",
    "name_en": "Security Misconfiguration",
    "category": "configuration",
    "owasp": "A02:2025",
    "cwe": ["CWE-16", "CWE-260"],
    "severity": "medium",
    "description": "不安全的默认配置或配置错误",
    "description_en": "Insecure default configurations or misconfigurations",
    "java_affected": ["Spring Boot", "Tomcat", "application.properties/yml"],
    "doc_path": "docs/vulnerabilities/configuration/security-misconfiguration.md",
    "detection_methods": ["配置审计", "漏洞扫描"],
    "mitigation": ["安全基线配置", "删除默认账户", "关闭调试模式"],
    "tags": ["configuration", "spring-boot", "tomcat", "default-credentials"],
    "last_updated": "2026-04-17",
    "references": [